{
  "id": "celeriac",
  "names": {
    "en": [
      "Celeriac"
    ],
    "fr": [
      "Céleri-rave"
    ]
  },
  "family": "Apiaceae",
  "species": "Apium graveolens var. rapaceum",
  "category": "root",
  "lifecycle": "biennial",
  "hardiness": "half-hardy",
  "minTempC": -5,
  "rotationGroup": "roots",
  "timing": [
    {
      "kind": "sowIndoor",
      "anchor": "lastFrost",
      "fromOffsetDays": -80,
      "toOffsetDays": -55
    },
    {
      "kind": "plantOut",
      "anchor": "lastFrost",
      "fromOffsetDays": 0,
      "toOffsetDays": 21
    },
    {
      "kind": "harvest",
      "anchor": "firstFrost",
      "fromOffsetDays": -30,
      "toOffsetDays": 90
    }
  ],
  "moduleDays": 70,
  "maxModuleDays": 90,
  "daysToHarvest": 200,
  "harvestWindowDays": 120,
  "propagation": {
    "seedsPerModule": 2,
    "germTempC": 18,
    "bottomHeat": true,
    "light": "needs light to germinate"
  },
  "spacing": {
    "inRowCm": 30,
    "betweenRowsCm": 40,
    "gridCm": 30
  },
  "seedLifeYears": 3,
  "seedSaving": {
    "pollination": "insect",
    "crosses": "readily",
    "isolationM": 800,
    "minPlants": 20
  },
  "pests": [
    "celery fly",
    "slugs"
  ],
  "varieties": [
    {
      "id": "celeriac--monarch",
      "cropId": "celeriac",
      "name": "Monarch",
      "seedType": "OP"
    }
  ],
  "sources": [
    {
      "note": "Starter library defaults, typical of temperate UK and northern European practice, expressed relative to local frost dates. Check against your own seed packets and local knowledge."
    }
  ]
}
