{
  "id": "lettuce",
  "names": {
    "en": [
      "Lettuce"
    ],
    "fr": [
      "Laitue",
      "Salade"
    ]
  },
  "family": "Asteraceae",
  "species": "Lactuca sativa",
  "category": "leaf",
  "lifecycle": "annual",
  "hardiness": "half-hardy",
  "minTempC": -3,
  "rotationGroup": "salads",
  "timing": [
    {
      "kind": "sowIndoor",
      "anchor": "lastFrost",
      "fromOffsetDays": -60,
      "toOffsetDays": 60
    },
    {
      "kind": "plantOut",
      "anchor": "lastFrost",
      "fromOffsetDays": -30,
      "toOffsetDays": 90
    },
    {
      "kind": "sowOutdoor",
      "anchor": "lastFrost",
      "fromOffsetDays": -20,
      "toAnchor": "firstFrost",
      "toOffsetDays": -60
    }
  ],
  "moduleDays": 28,
  "maxModuleDays": 40,
  "daysToHarvest": 60,
  "harvestWindowDays": 30,
  "propagation": {
    "seedsPerModule": 1,
    "germTempC": 12,
    "light": "germinates in light; avoid heat over 25 °C"
  },
  "spacing": {
    "inRowCm": 25,
    "betweenRowsCm": 25,
    "gridCm": 25,
    "perContainerL": 3
  },
  "seedLifeYears": 3,
  "seedSaving": {
    "pollination": "self",
    "crosses": "rarely",
    "isolationM": 3,
    "minPlants": 10
  },
  "pests": [
    "slugs",
    "aphids"
  ],
  "varieties": [
    {
      "id": "lettuce--butterhead",
      "cropId": "lettuce",
      "name": "Butterhead lettuce",
      "seedType": "OP",
      "names": {
        "fr": "Laitue pommée"
      }
    },
    {
      "id": "lettuce--cos",
      "cropId": "lettuce",
      "name": "Cos lettuce",
      "seedType": "OP",
      "names": {
        "fr": "Laitue romaine"
      }
    },
    {
      "id": "lettuce--loose-leaf",
      "cropId": "lettuce",
      "name": "Loose-leaf lettuce",
      "seedType": "OP",
      "names": {
        "fr": "Laitue à couper"
      }
    },
    {
      "id": "lettuce--winter-density",
      "cropId": "lettuce",
      "name": "Winter Density",
      "seedType": "OP"
    }
  ],
  "sources": [
    {
      "note": "Starter library defaults, typical of temperate UK and northern European practice, expressed relative to local frost dates. Check against your own seed packets and local knowledge."
    }
  ]
}
