{
  "id": "winter-squash",
  "names": {
    "en": [
      "Winter squash",
      "Pumpkin"
    ],
    "fr": [
      "Courge",
      "Potiron",
      "Courge d’hiver"
    ]
  },
  "family": "Cucurbitaceae",
  "species": "Cucurbita maxima",
  "category": "cucurbit",
  "lifecycle": "annual",
  "hardiness": "tender",
  "minTempC": 5,
  "rotationGroup": "cucurbits",
  "care": [
    "cure"
  ],
  "timing": [
    {
      "kind": "sowIndoor",
      "anchor": "lastFrost",
      "fromOffsetDays": -28,
      "toOffsetDays": -10
    },
    {
      "kind": "plantOut",
      "anchor": "lastFrost",
      "fromOffsetDays": 7,
      "toOffsetDays": 25
    },
    {
      "kind": "harvest",
      "anchor": "firstFrost",
      "fromOffsetDays": -30,
      "toOffsetDays": -5
    }
  ],
  "moduleDays": 25,
  "maxModuleDays": 40,
  "daysToHarvest": 120,
  "harvestWindowDays": 25,
  "frostFreeDaysNeeded": 110,
  "propagation": {
    "seedsPerModule": 1,
    "moduleSize": "9 cm pots",
    "germTempC": 20,
    "bottomHeat": true
  },
  "spacing": {
    "inRowCm": 120,
    "betweenRowsCm": 150,
    "gridCm": 120
  },
  "seedLifeYears": 5,
  "seedSaving": {
    "pollination": "insect",
    "crosses": "readily",
    "isolationM": 800,
    "minPlants": 6
  },
  "pests": [
    "slugs",
    "powdery mildew"
  ],
  "notes": "Cure in the sun or somewhere warm for two weeks before storing.",
  "varieties": [
    {
      "id": "winter-squash--crown-prince",
      "cropId": "winter-squash",
      "name": "Crown Prince",
      "seedType": "F1"
    },
    {
      "id": "winter-squash--uchiki-kuri",
      "cropId": "winter-squash",
      "name": "Uchiki Kuri",
      "seedType": "OP"
    },
    {
      "id": "winter-squash--butternut",
      "cropId": "winter-squash",
      "name": "Butternut",
      "seedType": "OP",
      "overrides": {
        "species": "Cucurbita moschata"
      }
    }
  ],
  "sources": [
    {
      "note": "Starter library defaults, typical of temperate UK and northern European practice, expressed relative to local frost dates. Check against your own seed packets and local knowledge."
    }
  ]
}
