{
  "id": "calendula",
  "names": {
    "en": [
      "Calendula",
      "Pot marigold"
    ]
  },
  "family": "Asteraceae",
  "species": "Calendula officinalis",
  "category": "flower",
  "lifecycle": "annual",
  "hardiness": "hardy",
  "rotationGroup": "misc",
  "timing": [
    {
      "kind": "sowIndoor",
      "anchor": "lastFrost",
      "fromOffsetDays": -45,
      "toOffsetDays": 0
    },
    {
      "kind": "plantOut",
      "anchor": "lastFrost",
      "fromOffsetDays": -14,
      "toOffsetDays": 30
    },
    {
      "kind": "sowOutdoor",
      "anchor": "lastFrost",
      "fromOffsetDays": -21,
      "toOffsetDays": 40
    }
  ],
  "moduleDays": 35,
  "maxModuleDays": 50,
  "daysToHarvest": 75,
  "harvestWindowDays": 100,
  "propagation": {
    "seedsPerModule": 1
  },
  "spacing": {
    "gridCm": 30
  },
  "seedLifeYears": 4,
  "seedSaving": {
    "pollination": "insect",
    "crosses": "readily",
    "isolationM": 100,
    "minPlants": 10
  },
  "varieties": [
    {
      "id": "calendula--indian-prince",
      "cropId": "calendula",
      "name": "Indian Prince",
      "seedType": "OP"
    }
  ],
  "sources": [
    {
      "note": "Starter library defaults, typical of temperate UK and northern European practice, expressed relative to local frost dates. Check against your own seed packets and local knowledge."
    }
  ]
}
