{
  "id": "sprouting-broccoli",
  "names": {
    "en": [
      "Sprouting broccoli",
      "Purple sprouting broccoli"
    ],
    "fr": [
      "Brocoli à jets",
      "Brocoli violet"
    ]
  },
  "family": "Brassicaceae",
  "species": "Brassica oleracea",
  "category": "brassica",
  "lifecycle": "biennial",
  "hardiness": "hardy",
  "minTempC": -12,
  "rotationGroup": "brassicas",
  "care": [
    "net",
    "support"
  ],
  "timing": [
    {
      "kind": "sowIndoor",
      "anchor": "lastFrost",
      "fromOffsetDays": -30,
      "toOffsetDays": 15
    },
    {
      "kind": "plantOut",
      "anchor": "lastFrost",
      "fromOffsetDays": 10,
      "toOffsetDays": 50
    },
    {
      "kind": "harvest",
      "anchor": "lastFrost",
      "fromOffsetDays": -90,
      "toOffsetDays": -20
    }
  ],
  "moduleDays": 35,
  "maxModuleDays": 50,
  "daysToHarvest": 280,
  "harvestWindowDays": 60,
  "spacing": {
    "inRowCm": 60,
    "betweenRowsCm": 60,
    "gridCm": 60
  },
  "seedLifeYears": 4,
  "seedSaving": {
    "pollination": "insect",
    "crosses": "readily",
    "isolationM": 1000,
    "minPlants": 20
  },
  "pests": [
    "cabbage white caterpillars",
    "pigeons",
    "clubroot",
    "flea beetle",
    "cabbage root fly"
  ],
  "varieties": [
    {
      "id": "sprouting-broccoli--early-purple",
      "cropId": "sprouting-broccoli",
      "name": "Early Purple Sprouting",
      "seedType": "OP"
    }
  ],
  "sources": [
    {
      "note": "Starter library defaults, typical of temperate UK and northern European practice, expressed relative to local frost dates. Check against your own seed packets and local knowledge."
    }
  ]
}
