{
  "id": "leek",
  "names": {
    "en": [
      "Leek"
    ],
    "fr": [
      "Poireau"
    ]
  },
  "family": "Amaryllidaceae",
  "species": "Allium ampeloprasum",
  "category": "allium",
  "lifecycle": "biennial",
  "hardiness": "hardy",
  "minTempC": -15,
  "rotationGroup": "alliums",
  "care": [
    "mesh"
  ],
  "timing": [
    {
      "kind": "sowIndoor",
      "anchor": "lastFrost",
      "fromOffsetDays": -110,
      "toOffsetDays": -60
    },
    {
      "kind": "plantOut",
      "anchor": "lastFrost",
      "fromOffsetDays": -14,
      "toOffsetDays": 45
    },
    {
      "kind": "harvest",
      "anchor": "firstFrost",
      "fromOffsetDays": -40,
      "toOffsetDays": 150
    }
  ],
  "moduleDays": 70,
  "maxModuleDays": 100,
  "daysToHarvest": 170,
  "harvestWindowDays": 150,
  "propagation": {
    "seedsPerModule": 4,
    "germTempC": 13
  },
  "spacing": {
    "inRowCm": 15,
    "betweenRowsCm": 30,
    "gridCm": 25
  },
  "seedLifeYears": 2,
  "seedSaving": {
    "pollination": "insect",
    "crosses": "readily",
    "isolationM": 1000,
    "minPlants": 20
  },
  "pests": [
    "leek moth",
    "rust",
    "allium leaf miner"
  ],
  "varieties": [
    {
      "id": "leek--musselburgh",
      "cropId": "leek",
      "name": "Musselburgh",
      "seedType": "OP"
    }
  ],
  "sources": [
    {
      "note": "Starter library defaults, typical of temperate UK and northern European practice, expressed relative to local frost dates. Check against your own seed packets and local knowledge."
    }
  ]
}
