{
  "id": "spring-onion",
  "names": {
    "en": [
      "Spring onion",
      "Scallion",
      "Salad onion"
    ],
    "fr": [
      "Oignon blanc",
      "Cébette",
      "Oignon nouveau"
    ]
  },
  "family": "Amaryllidaceae",
  "species": "Allium cepa",
  "category": "allium",
  "lifecycle": "annual",
  "hardiness": "hardy",
  "minTempC": -10,
  "rotationGroup": "alliums",
  "timing": [
    {
      "kind": "sowIndoor",
      "anchor": "lastFrost",
      "fromOffsetDays": -100,
      "toOffsetDays": -40
    },
    {
      "kind": "sowOutdoor",
      "anchor": "lastFrost",
      "fromOffsetDays": -30,
      "toAnchor": "firstFrost",
      "toOffsetDays": -60
    },
    {
      "kind": "overwinter",
      "anchor": "firstFrost",
      "fromOffsetDays": -75,
      "toOffsetDays": -50
    },
    {
      "kind": "harvest",
      "anchor": "lastFrost",
      "fromOffsetDays": -45,
      "toOffsetDays": 15
    }
  ],
  "moduleDays": 35,
  "maxModuleDays": 50,
  "daysToHarvest": 75,
  "harvestWindowDays": 45,
  "propagation": {
    "seedsPerModule": 8,
    "moduleSize": "3-4 cm cells",
    "germTempC": 12
  },
  "spacing": {
    "inRowCm": 2,
    "betweenRowsCm": 20,
    "gridCm": 10
  },
  "seedLifeYears": 1,
  "seedSaving": {
    "pollination": "insect",
    "crosses": "readily",
    "isolationM": 1000,
    "minPlants": 50
  },
  "pests": [
    "onion fly",
    "downy mildew"
  ],
  "varieties": [
    {
      "id": "spring-onion--white-lisbon",
      "cropId": "spring-onion",
      "name": "White Lisbon",
      "seedType": "OP"
    },
    {
      "id": "spring-onion--overwintering",
      "cropId": "spring-onion",
      "name": "Spring onion (overwintering)",
      "seedType": "OP",
      "overrides": {
        "hardiness": "hardy"
      },
      "notes": "Winter-hardy type for late summer sowing.",
      "names": {
        "fr": "Oignon blanc d’hiver"
      }
    }
  ],
  "sources": [
    {
      "note": "Starter library defaults, typical of temperate UK and northern European practice, expressed relative to local frost dates. Check against your own seed packets and local knowledge."
    }
  ]
}
